{
  "$schema": "https://json-schema.org/draft/2020-12/schema",
  "$id": "https://github.com/JackieL233/fengshui-master/schemas/portable-skill.schema.json",
  "title": "FengShui Master Portable Skill Manifest",
  "type": "object",
  "required": [
    "name",
    "type",
    "version",
    "title",
    "description",
    "languages",
    "entrypoints",
    "references",
    "tools",
    "evaluation",
    "integration",
    "governance",
    "guardrails",
    "domains",
    "schemas"
  ],
  "properties": {
    "name": { "type": "string", "const": "fengshui-master" },
    "type": { "type": "string", "const": "portable-ai-skill" },
    "version": { "type": "string" },
    "title": { "type": "string" },
    "description": { "type": "string" },
    "languages": {
      "type": "array",
      "items": { "type": "string" },
      "minItems": 2,
      "uniqueItems": true
    },
    "entrypoints": { "$ref": "#/$defs/pathList" },
    "references": { "$ref": "#/$defs/pathList" },
    "tools": { "$ref": "#/$defs/pathList" },
    "evaluation": { "$ref": "#/$defs/pathList" },
    "integration": { "$ref": "#/$defs/pathList" },
    "governance": { "$ref": "#/$defs/pathList" },
    "guardrails": {
      "type": "array",
      "items": { "type": "string" },
      "minItems": 3,
      "uniqueItems": true
    },
    "domains": {
      "type": "array",
      "items": { "type": "string" },
      "minItems": 5,
      "uniqueItems": true
    },
    "schemas": {
      "type": "object",
      "required": ["manifest", "evaluation_suite", "reference_catalog", "tool_catalog", "response_contract", "capability_matrix", "source_quality_policy", "adversarial_evaluation_suite", "intake_contracts", "golden_responses", "universal_domain_protocol", "external_calculation_contracts", "contribution_quality_gates", "runtime_integration_profiles", "agent_claims"],
      "properties": {
        "manifest": { "type": "string" },
        "evaluation_suite": { "type": "string" },
        "reference_catalog": { "type": "string" },
        "tool_catalog": { "type": "string" },
        "response_contract": { "type": "string" },
        "capability_matrix": { "type": "string" },
        "source_quality_policy": { "type": "string" },
        "adversarial_evaluation_suite": { "type": "string" },
        "intake_contracts": { "type": "string" },
        "golden_responses": { "type": "string" },
        "universal_domain_protocol": { "type": "string" },
        "external_calculation_contracts": { "type": "string" },
        "contribution_quality_gates": { "type": "string" },
        "runtime_integration_profiles": { "type": "string" },
        "agent_claims": { "type": "string" }
      },
      "additionalProperties": false
    }
  },
  "additionalProperties": false,
  "$defs": {
    "pathList": {
      "type": "array",
      "items": { "type": "string" },
      "minItems": 1,
      "uniqueItems": true
    }
  }
}
