{
  "name": "fengshui-master",
  "type": "portable-ai-skill",
  "version": "1.0.0",
  "title": "FengShui Master",
  "description": "Portable AI skill and Codex-compatible capability pack for traditional Chinese feng shui, wuxing, auspiciousness, spatial analysis, and cross-domain symbolic decision support.",
  "languages": ["en", "zh-CN"],
  "entrypoints": [
    "PORTABLE_SKILL.md",
    "fengshui-master/SKILL.md"
  ],
  "references": [
    "fengshui-master/references/foundation.md",
    "fengshui-master/references/forms-and-environment.md",
    "fengshui-master/references/schools.md",
    "fengshui-master/references/analysis-templates.md",
    "fengshui-master/references/remedies.md",
    "fengshui-master/references/timing-and-date-selection.md",
    "fengshui-master/references/xuan-kong-flying-stars.md",
    "fengshui-master/references/yin-house.md",
    "fengshui-master/references/broad-symbolic-analysis.md",
    "fengshui-master/references/domain-adapters.md",
    "fengshui-master/references/finance-adapter.md",
    "fengshui-master/references/business-adapter.md",
    "fengshui-master/references/brand-adapter.md",
    "fengshui-master/references/naming-adapter.md",
    "fengshui-master/references/career-adapter.md",
    "fengshui-master/references/relationship-adapter.md",
    "fengshui-master/references/product-adapter.md",
    "fengshui-master/references/learning-adapter.md",
    "fengshui-master/references/wellbeing-adapter.md",
    "fengshui-master/references/legal-adjacent-adapter.md",
    "fengshui-master/references/life-and-omen-adapter.md",
    "fengshui-master/references/proactive-reading-protocol.md",
    "fengshui-master/references/five-phase-domain-map.md",
    "fengshui-master/references/floorplan-schema.md",
    "fengshui-master/references/ethics-and-limits.md",
    "fengshui-master/references/classical-source-map.md",
    "fengshui-master/references/case-patterns.md",
    "fengshui-master/references/consultation-brief.md",
    "fengshui-master/references/glossary.md",
    "fengshui-master/references/reporting-protocol.md",
    "fengshui-master/references/sample-readings.md",
    "fengshui-master/references/sources.md"
  ],
  "tools": [
    "fengshui-master/scripts/method_selector.py",
    "fengshui-master/scripts/domain_router.py",
    "fengshui-master/scripts/create_brief.py",
    "fengshui-master/scripts/personal_context.py",
    "fengshui-master/scripts/generate_report.py",
    "fengshui-master/scripts/analyze_floorplan.py",
    "fengshui-master/scripts/bagua_map.py",
    "fengshui-master/scripts/luopan.py",
    "fengshui-master/scripts/minggua.py",
    "fengshui-master/scripts/ganzhi.py",
    "fengshui-master/scripts/annual_afflictions.py",
    "fengshui-master/scripts/periods.py",
    "fengshui-master/scripts/flying_stars.py",
    "fengshui-master/scripts/moon_phase.py",
    "fengshui-master/scripts/solar_terms.py"
  ],
  "evaluation": [
    "examples/portable-agent-prompts.md",
    "examples/portable-evaluation-rubric.json",
    "examples/portable-evaluation-suite.json",
    "examples/validate_portable_evaluation.py",
    "examples/validate_portable_manifest.py",
    "examples/reference-catalog.json",
    "examples/validate_reference_catalog.py",
    "examples/tool-catalog.json",
    "examples/validate_tool_catalog.py",
    "examples/response-contract.json",
    "examples/validate_response_contract.py",
    "examples/claim-evidence-policy.json",
    "examples/validate_claim_evidence.py",
    "examples/validate_json_schemas.py",
    "examples/capability-matrix.json",
    "examples/validate_capability_matrix.py",
    "examples/source-quality-policy.json",
    "examples/validate_source_quality_policy.py",
    "examples/adversarial-evaluation-suite.json",
    "examples/validate_adversarial_evaluation.py",
    "examples/intake-contracts.json",
    "examples/validate_intake_contracts.py",
    "examples/golden-responses.json",
    "examples/validate_golden_responses.py",
    "examples/universal-domain-protocol.json",
    "examples/validate_universal_domain_protocol.py",
    "examples/external-calculation-contracts.json",
    "examples/validate_external_calculation_contracts.py",
    "examples/contribution-quality-gates.json",
    "examples/validate_contribution_quality_gates.py",
    "examples/runtime-integration-profiles.json",
    "examples/validate_runtime_integration_profiles.py"
  ],
  "integration": [
    "docs/integration-guide.md"
  ],
  "schemas": {
    "manifest": "schemas/portable-skill.schema.json",
    "evaluation_suite": "schemas/portable-evaluation-suite.schema.json",
    "reference_catalog": "schemas/reference-catalog.schema.json",
    "tool_catalog": "schemas/tool-catalog.schema.json",
    "response_contract": "schemas/response-contract.schema.json",
    "capability_matrix": "schemas/capability-matrix.schema.json",
    "source_quality_policy": "schemas/source-quality-policy.schema.json",
    "adversarial_evaluation_suite": "schemas/adversarial-evaluation-suite.schema.json",
    "intake_contracts": "schemas/intake-contracts.schema.json",
    "golden_responses": "schemas/golden-responses.schema.json",
    "universal_domain_protocol": "schemas/universal-domain-protocol.schema.json",
    "external_calculation_contracts": "schemas/external-calculation-contracts.schema.json",
    "contribution_quality_gates": "schemas/contribution-quality-gates.schema.json",
    "runtime_integration_profiles": "schemas/runtime-integration-profiles.schema.json",
    "agent_claims": "schemas/agent-claims.schema.json"
  },
  "governance": [
    "SECURITY.md",
    "CODE_OF_CONDUCT.md",
    "CONTRIBUTING.md",
    "LICENSE"
  ],
  "guardrails": [
    "not medical advice",
    "not legal advice",
    "not financial advice",
    "not engineering or architectural advice",
    "no guaranteed prediction",
    "no deterministic fate claims",
    "use real-world constraints before symbolic interpretation"
  ],
  "domains": [
    "space",
    "life_omen",
    "finance",
    "business",
    "brand",
    "naming",
    "career",
    "relationship",
    "product",
    "learning",
    "wellbeing",
    "legal_adjacent",
    "timing"
  ]
}
